id,parent_id,nama,nama_alias,emails,alamat,website,telp,fax
993,0,Badan Penyelenggara Jaminan Sosial Kesehatan,BPJS Kesehatan,,,,,
1130,0,Badan Penyelenggara Jaminan Sosial Ketenagakerjaan,BPJS Ketenagakerjaan,,,,,
278,0,Badan Pusat Statistik,BPS,bpshq@bps.go.id,Jalan Dr. Sutomo 6-8 Jakarta 10710,http://www.bps.go.id/,021-3841195,021-3857046
840,0,Badan SAR Nasional,Basarnas,,,,,
9952,0,Badan Standardisasi Nasional,BSN,,,,,
271,0,Badan Tenaga Nuklir Nasional,BATAN,humas@batan.go.id,"Jl. Kuningan Barat, Mampang Prapatan Jakarta, 12710",http://www.batan.go.id/,(021) 525-1109,(021) 525-1110
277,0,Bank Indonesia,BI,humasbi@bi.go.id,Jl. MH. Thamrin 2 Jakarta 10110 Indonesia,http://www.bi.go.id/web/id/,(62-21) 381-7187,(62-21) 350-1867
715,0,Direktorat Jenderal Bea Cukai,Ditjen Bea Cukai,pengaduan.beacukai@customs.go.id,"Kantor Pusat Bea dan Cukai Jl. Ahmad Yani By Pass - Rawamangun, Jakarta Timur Jakarta - 13230",http://www.beacukai.go.id/,021-4890308 ext 821 / 822,021 - 489 0966
748,0,Direktorat Jenderal Bina Marga Kementerian Pekerjaan Umum,Ditjen Bina Marga PU,,,,,
747,0,Direktorat Jenderal Kereta Api Kementerian Perhubungan,Ditjen KA Kemenhub,,,,,
749,0,Direktorat Jenderal Migas Kementerian Energi dan Sumber Daya Mineral,Ditjen Migas Kemen ESDM,,,,,
714,0,Direktorat Jenderal Pajak,Ditjen Pajak,,"Jl. Gatot Subroto No. 40-42, Jakarta Indonesia 12190",http://www.pajak.go.id/,"(021) 5250208, 5251609, 5262880",
755,0,Direktorat Lantas Polda Metro Jaya,Ditlantas Polda Metro Jaya,,,,,
717,0,Inspektur Jenderal Kementerian Keuangan,Itjen Kemenkeu,itjen@depkeu.go.id,Gedung Djuanda II Lantai IV-XIII Kementerian Keuangan Jalan dr. Wahidin No. 1 Jakarta 10710 Kotak Pos 3132 Jkt. 10031,http://www.itjen.depkeu.go.id/,+62 21-3865430,+62 21-3440907
10290,0,Kantor Staf Presiden,KSP,,,,,
10037,0,Kawal Menteri,,,,,,
420,0,Kejaksaan Agung Republik Indonesia,Kejagung,humas_puspenkum@yahoo.co.uk,"Jalan Sultan Hasanuddin No. 1 Kebayoran Baru, Jakarta Selatan",http://www.kejaksaan.go.id/index.php,021-7221269,
253,0,Kementerian Agama,KemenAg,pinmas@kemenag.go.id,Jalan Lapangan Banteng Barat No. 3-4 Jakarta 10710,http://www.kemenag.go.id/,021-3812306 / 021-3811642 / 021-3811654 / 021-3800200,021-3800174
52,0,Kementerian Agraria dan Tata Ruang / BPN,BPN,pusdatin@bpn.go.id,"Gedung Badan Pertanahan Nasional Lantai V Jalan Sisingamangaraja No. 2 Kebayoran Baru, Jakarta 12110",http://www.bpn.go.id,021-7393939,
54,0,Kementerian Badan Usaha Milik Negara (BUMN),KemenBUMN,,Jalan Medan Merdeka Selatan No. 13 Jakarta 10110,http://www.bumn.go.id/,SMS 08111188188,
63,0,Kementerian Dalam Negeri,KemenDagri,pusdatinkomtel@depdagri.go.id,Jalan Medan Merdeka Utara No. 7 Jakarta Pusat,http://www.kemendagri.go.id,021-3450038,021-3851193 / 021-34830261 / 021-384643
261,0,"Kementerian Desa, Pembangunan Daerah Tertinggal, dan Transmigrasi",KPDT,http://mail.kemenegpdt.go.id/login.php,Jalan Abdul Muis No. 7 Jakarta Pusat Jakarta Pusat 10110,http://www.kemenegpdt.go.id/,021-3500334,
55,0,Kementerian Energi dan Sumber Daya Mineral (ESDM),KemenESDM,pie@esdm.go.id,Jalan Merdeka Selatan 18 Jakarta 10110,http://www.esdm.go.id/,021-3804242,021-3847461
248,0,Kementerian Hukum dan HAM,Kemenkumham,,"Jalan H.R. Rasuna Said Kav. 6-7 Kuningan, Jakarta Selatan",http://www.kemenkumham.go.id,021-5253004 ext. 362,
251,0,Kementerian Kelautan dan Perikanan,KemenK&P,,Jalan Merdeka Timur No. 16 Jakarta Pusat,http://www.kkp.go.id/,021-3500041 / 021-3519070,021-35100049 / 021-3500042
118,0,Kementerian Kesehatan,KemenKes,kontak@depkes.go.id,Jalan H.R. Rasuna Said Blok X5 Kav. 4-9 Kuningan Jakarta 12950,http://sehatnegeriku.com/kontak/,021-52907416/9,021-5223002 / 021-52960661 / 021-52921669
252,0,Kementerian Ketenagakerjaan,Kemnaker,http://www.depnakertrans.go.id/contact.html,Jalan TMP Kalibata 17 Jakarta Selatan / Jalan Jendral Gatot Subroto Kav 51 Jakarta Pusat,http://www.depnakertrans.go.id/,021-5229285/6 / 021-7989924 / 021-525685/88,021-7974488 / 021-5256559
50,0,Kementerian Keuangan,KemenKeu,portalkemenkeu@depkeu.go.id,Gedung Djuanda I Lantai 12 Jalan Dr. Wahidin Raya No. 1 Jakarta 10710 Kotak Pos 21,http://www.depkeu.go.id/,021-3861489,021-3845724
255,0,Kementerian Komunikasi dan Informatika,KemenKominfo,http://kontak.kominfo.go.id/index.php,Jalan Medan Merdeka Barat No. 9 Jakarta 10110,http://kominfo.go.id/,021-3500488 / 021-3846189 / 021-38449931,021-3811113 / 021-3865154
9963,0,Kementerian Koordinator Bidang Kemaritiman,Kemenko Maritim,,,,,
245,0,Kementerian Koordinator Bidang Pembangunan Manusia dan Kebudayaan,Kemenko PMK,,Jalan Medan Merdeka Barat No. 3 Jakarta,http://www.menkokesra.go.id/,021-3459444,
51,0,Kementerian Koordinator Bidang Perekonomian,Kemenko Ekon,,Jalan Lapangan Banteng Timur No. 2-4 Jakarta,,021-3808384,021-3440394
244,0,"Kementerian Koordinator Bidang Politik, Hukum, dan Keamanan",Kemenko Polhukam,,Jalan Medan Merdeka Barat No. 15 Jakarta Pusat 10110,http://www.polkam.go.id/,021-3521121 / 021-3520145,
258,0,Kementerian Koperasi dan Usaha Kecil Menengah,KemenKopUKM,bagdat@depkop.go.id,"Jalan H.R. Rasuna Said Kav. 3-4 Kuningan, Jakarta 12940",http://www.depkop.go.id/,021-5204366/72,
9965,0,Kementerian Lingkungan Hidup dan Kehutanan,KLHK,,,,,
246,0,Kementerian Luar Negeri,KemenLu,nfomed@deplu.go.id,Jalan Taman Pejambon No. 6 Jakarta Pusat 10110,http://www.kemlu.go.id/,021-3441508,021-380551
254,0,Kementerian Pariwisata,Kemenpar,http://www.budpar.go.id/asp/ringkasan.asp?c=1005&nk=1,Jalan Medan Merdeka Barat No. 27 Jakarta 10110,http://www.budpar.go.id/,021-3838565 / 021-3838102 / 021-3838805 / 021-386700,021-344079 / 021-3848245
9964,0,Kementerian Pekerjaan Umum dan Perumahan Rakyat,PU Pera,,,,,
136,0,Kementerian Pemberdayaan Perempuan dan Perlindungan Anak,KemenPP&PA;,,Jalan Medan Merdeka Barat No. 15 Jakarta 10110,http://www.menegpp.go.id/,021-380-539 / 021-380563,021-3810052
263,0,Kementerian Pemuda dan Olah Raga,KemenPora,http://kemenpora.go.id/index/kotakpesan,"Jalan Gerbang Pemuda No. 3 Senayan, Jakarta 10270",http://www.kemenpora.go.id/,021-5738155,021-5738152
260,0,Kementerian Pendayagunaan Aparatur Negara dan Reformasi Birokrasi,KemenPAN & RB,kontak.kami@menpan.go.id,Jalan Jenderal Sudirman Kav. 69 Jakarta,http://www.menpan.go.id/,021-739838/89,
416,0,Kementerian Pendidikan dan Kebudayaan,Kemendikbud,pengaduan@kemdikbud.go.id,"Jalan Jenderal Sudirman, Senayan, Jakarta 10270",http://www.kemdiknas.go.id/kemdikbud/,021-57950226 / 021-5731618 / 021-5733128,021-5733125 / 021-5736870
65,0,Kementerian Perdagangan,KemenDag,contact.us@kemendag.go.id,Jalan M. I. Ridwan Rais No. 5 Jakarta Pusat 10110,,021-3858171 / 021-3841961/62,
62,0,Kementerian Perencanaan Pembangunan Nasional / Bappenas,BAPPENAS,http://www.bappenas.go.id/contact-us/form/,"Jalan Raden Patah I No. 1 Kebayoran Baru, Jakarta Selatan",http://www.bappenas.go.id/,021-7397758 / 021-7245751,021-7397727
44,0,Kementerian Perhubungan,KemenHub,http://www.dephub.go.id/pengaduanweb/,Jalan Medan Merdeka Barat No. 8 Jakarta Pusat,http://www.dephub.go.id/,021-3852649 / 021-3456779,021-3451657
67,0,Kementerian Perindustrian,KemenPerin,http://www.kemenperin.go.id/contact,Jalan Gatot Subroto Kav. 52-53 Jakarta Selatan,http://www.kemenperin.go.id/,021-5256458 / 021-5251149,021-5201606
247,0,Kementerian Pertahanan,KemenHan,postmaster@kemhan.go.id,Jalan Medan Merdeka Barat No. 13-14 Jakarta Pusat,http://www.kemhan.go.id/kemhan/,021-382050,
250,0,Kementerian Pertanian,KemenTan,http://www.deptan.go.id/e-mail/email_pejabat_deptan.htm,"Jalan Harsono RM. No. 3 Ragunan, Jakarta 12550",http://www.deptan.go.id/index1.php,http://www.deptan.go.id/e-mail/email_pejabat_deptan.htm,http://www.deptan.go.id/e-mail/email_pejabat_deptan.htm
256,0,"Kementerian Riset, Teknologi, dan Pendidikan Tinggi",Ristek Dikti,,"Gedung II BPPT Lt. 5,6,7,8,23 dan 24 Jalan MH Thamrin 8, Jakarta 10340, PO.Box 3110 JKP 10031",http://www.ristek.go.id/,021-3169119 / 021-3169127,021-3101835
275,0,Kementerian Sekretariat Negara,Setneg,,Jalan Veteran No. 17 - 18 Jakarta 10110,http://www.setneg.go.id/,,
126,0,Kementerian Sosial,KemenSos,http://www.kemsos.go.id/modules.php?name=Feedback,Jalan Salemba Raya No. 28 Jakarta 10430,http://www.kemsos.go.id/,021-3103591 Ext. 2100-2233 / 2205/17,021-3103783
45,0,Kepolisian Republik Indonesia,Polri,nfo@polri.go.id,"Rotekinfo Div. TI Polri, Jalan Trunojoyo No.3 Jakarta Selatan",http://www.polri.go.id,021-721814,
9954,0,Komisi Kejaksaan Republik Indonesia,KKRI,,,,,
994,0,Komisi Kepolisian Nasional,Kompolnas,,,,,
777,0,Komisi Pemberantasan Korupsi,KPK,pengaduan@kpk.go.id,Jalan HR Rasuna Said Kav. C-1 Jakarta 12920,http://www.kpk.go.id/,021-25578300,
280,0,Komisi Pemilihan Umum,KPU,redaktur@kpu.go.id,"Jl. Imam Bonjol No. 29, Jakarta 10310",http://www.kpu.go.id/,021-31937223,021-3157759
10319,0,LaporPresiden,,,,,,
160,0,Lembaga Administrasi Negara,LAN,,Jalan Veteran No. 10 Jakarta Pusat 10110,www.lan.go.id,"021-3455021-025 / 3868201 - 05, ext. 202, 203",021-3520260
844,0,Lembaga Ilmu Pengetahuan Indonesia,LIPI,,"Jl. Jend. Gatot Subroto No. 10, Jakarta",http://www.lipi.go.id/,021-5225711,
272,0,Lembaga Kebijakan Pengadaan Barang/Jasa Pemerintah,LKPP,humas@lkpp.go.id,Gedung SMESCO UKM Lt. 8 Jalan Gatot Subroto Kav. 94 Jakarta 12780,http://www.lkpp.go.id/v2/,021-7991025,021-7996033 / 021-7991125
273,0,Lembaga Penerbangan dan Antariksa Nasional,LAPAN,,Jl. Pemuda Persil No.1 Jakarta 13220,http://www.lapan.go.id/,(021) 4892802,(021) 4892815
279,0,Lembaga Sandi Negara,LEMSANEG,humas@lemsaneg.go.id,"Jalan Harsono RM No.70 Ragunan, Ps.Minggu, Jakarta Selatan 12550",http://www.lemsaneg.go.id/,021-7805814,021-78844104
274,0,Mabes TNI,Mabes TNI,,,http://www.tni.mil.id/,,
779,0,Mahkamah Agung,Badan Pengawasan MA,,"Jalan Jend. Ahmad Yani Kav. 58 Bypass Cempaka Putih, Jakarta Pusat",,2129079177,
837,0,Mahkamah Konstitusi,,,,,,
776,0,Ombudsman Republik Indonesia,Ombudsman,,Jalan H.R. Rasuna Said Kav. C-19 Kuningan (Gedung Pengadilan TIPIKOR) Jakarta Selatan,http://www.ombudsman.go.id/,021-52960894/95,021-52960904/05
1065,0,Otoritas Jasa Keuangan,OJK,,,,,
10298,0,Pay What You Pay,PWYP,,,,,
772,0,Pemerintah Kabupaten Bekasi,Pemkab Bekasi,http://mail.bekasikab.go.id/,,http://www.bekasikab.go.id/,,
773,0,Pemerintah Kabupaten Bogor,Pemkab Bogor,spswd@diskominfo.bogorkab.go.id,"Jl. Tegar Beriman, Cibinong - 16914",http://www.bogorkab.go.id/,"(021) 8758605,8751929",(021) 8758605
1136,0,Pemerintah Kabupaten Bojonegoro,Pemkab Bojonegoro,,Jl. P. Mas Tumapel No. 01 Bojonegoro Jawa Timur 62111,http://bojonegorokab.go.id/,(0353) 881826,
847,0,Pemerintah Kabupaten Buru,Pemkab Buru,,,,,
848,0,Pemerintah Kabupaten Buru Selatan,Pemkab Busel,,,,,
1071,0,Pemerintah Kabupaten Gorontalo,Pemkab Gorontalo,,Jln. Kolonel Rauf No.357,http://www.gorontalokab.go.id/,,
949,0,Pemerintah Kabupaten Indragiri Hulu,Pemkab Inhu,,"Jl. Raya Pematang Rebah, Rengat, Riau",www.inhukab.go.id,"(0769) 341006, 341010",(0769) 341005
849,0,Pemerintah Kabupaten Kepulauan Aru,Pemkab Aru,,,,,
850,0,Pemerintah Kabupaten Maluku Barat Daya,Pemkab Malbada,,,,,
851,0,Pemerintah Kabupaten Maluku Tengah,Pemkab Malteng,,,,,
852,0,Pemerintah Kabupaten Maluku Tenggara,Pemkab Maltenggara,,,,,
853,0,Pemerintah Kabupaten Maluku Tenggara Barat,Pemkab Maltenggabar,,,,,
854,0,Pemerintah Kabupaten Seram Bagian Barat,Pemkab Serbar,,,,,
855,0,Pemerintah Kabupaten Seram Bagian Timur,Pemkab Sertim,,,,,
47,0,Pemerintah Kabupaten Tangerang,PemKab PemKab Tangerang,,,,,
846,0,Pemerintah Kota Ambon,Pemkot Ambon,,,,,
862,0,Pemerintah Kota Bandung,Pemkot Bandung,,,,,
48,0,Pemerintah Kota Bekasi,PemKab PemKot Bekasi,,,,,
46,0,Pemerintah Kota Bogor,PemKab PemKot Bogor,,,,,
56,0,Pemerintah Kota Depok,PemKab PemKot Depok,,,,,
562,0,Pemerintah Kota Tangerang Selatan,PemKab PemKot Tangsel,,,,,
856,0,Pemerintah Kota Tual,Pemkot Tual,,,,,
1,0,Pemerintah Provinsi Aceh,Pemprov Aceh,,,,,
17,0,Pemerintah Provinsi Bali,Pemprov Bali,,,,,
16,0,Pemerintah Provinsi Banten,Pemrpov Banten,,,,,
7,0,Pemerintah Provinsi Bengkulu,Pemprov Bengkulu,,,,,
14,0,Pemerintah Provinsi DI Yogyakarta,Pemprov DIY,,,,,
11,0,Pemerintah Provinsi DKI Jakarta,Pemprov Jakarta,dki@jakarta.go.id,"Dinas Komunikasi, Informatika dan Kehumasan Pemprov DKI Jakarta, Jalan Medan Merdeka Selatan 8-9 Blok F Lt 1 Jakarta",http://www.jakarta.go.id/web/,021-3822255,021-3822255
28,0,Pemerintah Provinsi Gorontalo,Pemprov Gorontalo,,,,,
5,0,Pemerintah Provinsi Jambi,Pemprov Jambi,,,,,
12,0,Pemerintah Provinsi Jawa Barat,Pemprov Jabar,,,,,
13,0,Pemerintah Provinsi Jawa Tengah,Pemprov Jateng,,Jl. Pahlawan 9 Semarang,http://www.jatengprov.go.id/,"(024) 8311554, 8311174 Ps. 201",
15,0,Pemerintah Provinsi Jawa Timur,Pemprov Jatim,,,,,
20,0,Pemerintah Provinsi Kalimantan Barat,Pemprov Kalbar,,,,,
22,0,Pemerintah Provinsi Kalimantan Selatan,Pemprov Kalsel,,,,,
21,0,Pemerintah Provinsi Kalimantan Tengah,Pemprov Kalteng,,,,,
23,0,Pemerintah Provinsi Kalimantan Timur,Pemprov Kaltim,,,,,
9,0,Pemerintah Provinsi Kepulauan Bangka Belitung,Pemprov Babel,,,,,
10,0,Pemerintah Provinsi Kepulauan Riau,Pemprov Kepri,,,,,
8,0,Pemerintah Provinsi Lampung,Pemprov Lampung,,,,,
30,0,Pemerintah Provinsi Maluku,Pemprov Maluku,,,,,
31,0,Pemerintah Provinsi Maluku Utara,Pemprov Malut,,,,,
18,0,Pemerintah Provinsi Nusa Tenggara Barat,Pemprov NTB,,,,,
19,0,Pemerintah Provinsi Nusa Tenggara Timur,Pemprov NTT,,,,,
33,0,Pemerintah Provinsi Papua,Pemprov Papua,,,,,
32,0,Pemerintah Provinsi Papua Barat,Pemprov Papua Barat,,,,,
4,0,Pemerintah Provinsi Riau,Pemprov Riau,,,,,
29,0,Pemerintah Provinsi Sulawesi Barat,Pemprov Sulbar,,,,,
26,0,Pemerintah Provinsi Sulawesi Selatan,Pemprov Sulsel,,,,,
25,0,Pemerintah Provinsi Sulawesi Tengah,Pemprov Sulteng,,,,,
27,0,Pemerintah Provinsi Sulawesi Tenggara,Pemprov Sultra,,,,,
24,0,Pemerintah Provinsi Sulawesi Utara,Pemprov Sulut,,,,,
3,0,Pemerintah Provinsi Sumatera Barat,Pemprov Sumbar,,,,,
6,0,Pemerintah Provinsi Sumatera Selatan,Pemprov Sumsel,,,,,
2,0,Pemerintah Provinsi Sumatera Utara,Pemprov Sumut,,,,,
1070,0,Perpustakaan Nasional Republik Indonesia,Perpusnas,,Jl. Salemba Raya 28A Jakarta,http://www.pnri.go.id/,,
69,0,PT Kereta Api Indonesia (KAI),KAI,,,,,
763,0,PT MRT,,,,,,
53,0,PT Pertamina,Pertamina,pcc@pertamina.com,Jl. Medan Merdeka Timur 1A Jakarta 10110,,6221500000,
632,0,Satuan Kerja Khusus Pelaksana Kegiatan Usaha Hulu Minyak dan Gas Bumi,SKK Migas,hupmas@skkmigas.go.id,"Gedung Wisma Mulia Lantai 35 Jl. Gatot Subroto No.42, Jakarta 12710",http://www.skkmigas.go.id/,021-29241607,021-29249999
716,0,Sekretariat Jenderal Kementerian Keuangan,Setjen Kemenkeu,helpdesk@depkeu.go.id,Gedung E(Gedung Juanda I) Lantai 4 Jl. Dr.Wahidin Raya Nomor 1 Jakarta 10710,http://www.setjen.depkeu.go.id/,"(021) 344.9230 ext. 6116, 6117, 6118 (021) 384.0651,(021) 351.0055",(021) 3844784
276,0,Sekretariat Kabinet (SETKAB),,,,http://www.setkab.go.id/home,,
1053,0,Sekretariat Kelompok Kerja Pengendali PNPM Mandiri - Kemenko Kesra,Pokja Pengendali PNPM Mandiri,,"Jl. Medan Merdeka Barat No. 3, Jakarta Pusat 10110",http://www.pnpm-mandiri.org/,(021) 345 9077,(021) 345 9077
10282,0,SOCA Bandung,,,,,,
857,0,Tim Nasional Percepatan Penanggulangan Kemiskinan,TNP2K,,"Grand Kebon Sirih Lt. 4, Jl. Kebon Sirih Raya No. 35 Jakarta Pusat 10110",http://tnp2k.go.id/,62213912812,
982,0,Tim Penanggulangan Banjir DKI,,,,,,
858,0,Tim Sosialisasi Kebijakan Penyesuaian Subsidi BBM,,,,,,
10038,0,Tim Sosialisasi KKS,,,,,,
